{
  "$schema": "https://json-schema.org/draft/2020-12/schema",
  "title": "awesome-generative-3d entries",
  "type": "array",
  "items": {
    "type": "object",
    "additionalProperties": false,
    "required": ["id", "name", "url", "repo", "category", "chain", "description", "status", "license", "added"],
    "properties": {
      "id": { "type": "string", "pattern": "^[a-z0-9]+(-[a-z0-9]+)*$" },
      "name": { "type": "string", "minLength": 1 },
      "url": { "type": "string", "format": "uri", "pattern": "^https?://" },
      "repo": { "type": ["string", "null"], "pattern": "^https?://" },
      "category": { "type": "string", "description": "An id from categories.json" },
      "chain": { "type": "string", "enum": ["none"] },
      "description": { "type": "string", "minLength": 1, "maxLength": 160 },
      "status": { "type": "string", "enum": ["active", "early", "archived"] },
      "license": { "type": ["string", "null"] },
      "added": { "type": "string", "pattern": "^\\d{4}-\\d{2}-\\d{2}$" }
    }
  }
}
