[
  {
    "id": "3dtopia-xl",
    "name": "3DTopia-XL",
    "url": "https://3dtopia.github.io/3DTopia-XL/",
    "repo": "https://github.com/3DTopia/3DTopia-XL",
    "category": "image-to-3d-models",
    "chain": "none",
    "description": "High-quality PBR asset generation through primitive diffusion (CVPR 2025).",
    "status": "active",
    "license": "Apache-2.0",
    "added": "2026-10-10"
  },
  {
    "id": "hunyuan3d-2",
    "name": "Hunyuan3D-2",
    "url": "https://github.com/Tencent-Hunyuan/Hunyuan3D-2",
    "repo": "https://github.com/Tencent-Hunyuan/Hunyuan3D-2",
    "category": "image-to-3d-models",
    "chain": "none",
    "description": "Tencent high-resolution 3D asset generation with a shape diffusion model and a texture synthesis pipeline.",
    "status": "active",
    "license": "Tencent Hunyuan 3D 2.0 Community License",
    "added": "2026-10-10"
  },
  {
    "id": "hunyuan3d-2-1",
    "name": "Hunyuan3D-2.1",
    "url": "https://github.com/Tencent-Hunyuan/Hunyuan3D-2.1",
    "repo": "https://github.com/Tencent-Hunyuan/Hunyuan3D-2.1",
    "category": "image-to-3d-models",
    "chain": "none",
    "description": "Tencent image-to-3D system that produces high-fidelity assets with production-ready PBR materials.",
    "status": "active",
    "license": "Tencent Hunyuan 3D 2.1 Community License",
    "added": "2026-10-10"
  },
  {
    "id": "hunyuan3d-omni",
    "name": "Hunyuan3D-Omni",
    "url": "https://github.com/Tencent-Hunyuan/Hunyuan3D-Omni",
    "repo": "https://github.com/Tencent-Hunyuan/Hunyuan3D-Omni",
    "category": "image-to-3d-models",
    "chain": "none",
    "description": "Unified framework from Tencent for controllable generation of 3D assets.",
    "status": "active",
    "license": null,
    "added": "2026-10-10"
  },
  {
    "id": "instantmesh",
    "name": "InstantMesh",
    "url": "https://github.com/TencentARC/InstantMesh",
    "repo": "https://github.com/TencentARC/InstantMesh",
    "category": "image-to-3d-models",
    "chain": "none",
    "description": "Efficient mesh generation from a single image using sparse-view large reconstruction models.",
    "status": "active",
    "license": "Apache-2.0",
    "added": "2026-10-10"
  },
  {
    "id": "lgm",
    "name": "LGM",
    "url": "https://me.kiui.moe/lgm/",
    "repo": "https://github.com/3DTopia/LGM",
    "category": "image-to-3d-models",
    "chain": "none",
    "description": "Large Multi-View Gaussian Model for high-resolution 3D content creation (ECCV 2024).",
    "status": "active",
    "license": "MIT",
    "added": "2026-10-10"
  },
  {
    "id": "midi-3d",
    "name": "MIDI-3D",
    "url": "https://github.com/VAST-AI-Research/MIDI-3D",
    "repo": "https://github.com/VAST-AI-Research/MIDI-3D",
    "category": "image-to-3d-models",
    "chain": "none",
    "description": "Multi-instance diffusion that generates a composed 3D scene from a single image (CVPR 2025).",
    "status": "active",
    "license": "Apache-2.0",
    "added": "2026-10-10"
  },
  {
    "id": "point-e",
    "name": "Point-E",
    "url": "https://github.com/openai/point-e",
    "repo": "https://github.com/openai/point-e",
    "category": "image-to-3d-models",
    "chain": "none",
    "description": "OpenAI point cloud diffusion for 3D model synthesis from text or images.",
    "status": "active",
    "license": "MIT",
    "added": "2026-10-10"
  },
  {
    "id": "shap-e",
    "name": "Shap-E",
    "url": "https://github.com/openai/shap-e",
    "repo": "https://github.com/openai/shap-e",
    "category": "image-to-3d-models",
    "chain": "none",
    "description": "OpenAI model that generates 3D objects conditioned on text or images.",
    "status": "active",
    "license": "MIT",
    "added": "2026-10-10"
  },
  {
    "id": "stable-fast-3d",
    "name": "Stable Fast 3D",
    "url": "https://github.com/Stability-AI/stable-fast-3d",
    "repo": "https://github.com/Stability-AI/stable-fast-3d",
    "category": "image-to-3d-models",
    "chain": "none",
    "description": "Stability AI single-image mesh reconstruction with UV unwrapping and illumination disentanglement (SF3D).",
    "status": "active",
    "license": "Stability AI Community License",
    "added": "2026-10-10"
  },
  {
    "id": "stable-point-aware-3d",
    "name": "Stable Point-Aware 3D",
    "url": "https://github.com/Stability-AI/stable-point-aware-3d",
    "repo": "https://github.com/Stability-AI/stable-point-aware-3d",
    "category": "image-to-3d-models",
    "chain": "none",
    "description": "Stability AI single-image reconstruction of 3D objects using a point-aware approach (SPAR3D).",
    "status": "active",
    "license": "Stability AI Community License",
    "added": "2026-10-10"
  },
  {
    "id": "trellis",
    "name": "TRELLIS",
    "url": "https://trellis3d.github.io",
    "repo": "https://github.com/microsoft/TRELLIS",
    "category": "image-to-3d-models",
    "chain": "none",
    "description": "Microsoft structured 3D latent model that generates Gaussians, radiance fields and meshes from text or images (CVPR 2025).",
    "status": "active",
    "license": "MIT",
    "added": "2026-10-10"
  },
  {
    "id": "trellis-2",
    "name": "TRELLIS.2",
    "url": "https://github.com/microsoft/TRELLIS.2",
    "repo": "https://github.com/microsoft/TRELLIS.2",
    "category": "image-to-3d-models",
    "chain": "none",
    "description": "Microsoft follow-up using native, compact structured latents for 3D generation.",
    "status": "active",
    "license": "MIT",
    "added": "2026-10-10"
  },
  {
    "id": "triposf",
    "name": "TripoSF",
    "url": "https://github.com/VAST-AI-Research/TripoSF",
    "repo": "https://github.com/VAST-AI-Research/TripoSF",
    "category": "image-to-3d-models",
    "chain": "none",
    "description": "SparseFlex representation for high-resolution 3D shape modeling with arbitrary topology.",
    "status": "active",
    "license": "MIT",
    "added": "2026-10-10"
  },
  {
    "id": "triposg",
    "name": "TripoSG",
    "url": "https://github.com/VAST-AI-Research/TripoSG",
    "repo": "https://github.com/VAST-AI-Research/TripoSG",
    "category": "image-to-3d-models",
    "chain": "none",
    "description": "High-fidelity 3D shape synthesis built on large-scale rectified flow models.",
    "status": "active",
    "license": "MIT",
    "added": "2026-10-10"
  },
  {
    "id": "triposr",
    "name": "TripoSR",
    "url": "https://github.com/VAST-AI-Research/TripoSR",
    "repo": "https://github.com/VAST-AI-Research/TripoSR",
    "category": "image-to-3d-models",
    "chain": "none",
    "description": "Fast feed-forward 3D object reconstruction from a single image.",
    "status": "active",
    "license": "MIT",
    "added": "2026-10-10"
  },
  {
    "id": "dreamgaussian",
    "name": "DreamGaussian",
    "url": "https://dreamgaussian.github.io/",
    "repo": "https://github.com/dreamgaussian/dreamgaussian",
    "category": "text-to-3d-frameworks",
    "chain": "none",
    "description": "Generative Gaussian splatting for efficient text-to-3D and image-to-3D content creation (ICLR 2024).",
    "status": "active",
    "license": "MIT",
    "added": "2026-10-10"
  },
  {
    "id": "gaussiandreamer",
    "name": "GaussianDreamer",
    "url": "https://taoranyi.com/gaussiandreamer/",
    "repo": "https://github.com/hustvl/GaussianDreamer",
    "category": "text-to-3d-frameworks",
    "chain": "none",
    "description": "Fast text-to-3D Gaussian generation that bridges 2D and 3D diffusion models (CVPR 2024).",
    "status": "active",
    "license": "Apache-2.0",
    "added": "2026-10-10"
  },
  {
    "id": "stable-dreamfusion",
    "name": "stable-dreamfusion",
    "url": "https://github.com/ashawkey/stable-dreamfusion",
    "repo": "https://github.com/ashawkey/stable-dreamfusion",
    "category": "text-to-3d-frameworks",
    "chain": "none",
    "description": "Text-to-3D and image-to-3D with mesh export, using NeRF and diffusion guidance.",
    "status": "active",
    "license": "Apache-2.0",
    "added": "2026-10-10"
  },
  {
    "id": "threestudio",
    "name": "threestudio",
    "url": "https://github.com/threestudio-project/threestudio",
    "repo": "https://github.com/threestudio-project/threestudio",
    "category": "text-to-3d-frameworks",
    "chain": "none",
    "description": "Unified framework for 3D content generation covering many text-to-3D and image-to-3D methods.",
    "status": "active",
    "license": "Apache-2.0",
    "added": "2026-10-10"
  },
  {
    "id": "mv-adapter",
    "name": "MV-Adapter",
    "url": "https://huanngzh.github.io/MV-Adapter-Page/",
    "repo": "https://github.com/huanngzh/MV-Adapter",
    "category": "multi-view-diffusion",
    "chain": "none",
    "description": "Adapter that adds multi-view consistent image generation to existing diffusion models (ICCV 2025).",
    "status": "active",
    "license": "Apache-2.0",
    "added": "2026-10-10"
  },
  {
    "id": "syncdreamer",
    "name": "SyncDreamer",
    "url": "https://liuyuan-pal.github.io/SyncDreamer/",
    "repo": "https://github.com/liuyuan-pal/SyncDreamer",
    "category": "multi-view-diffusion",
    "chain": "none",
    "description": "Generates multiview-consistent images from a single-view image (ICLR 2024 Spotlight).",
    "status": "active",
    "license": "MIT",
    "added": "2026-10-10"
  },
  {
    "id": "wonder3d",
    "name": "Wonder3D",
    "url": "https://www.xxlong.site/Wonder3D/",
    "repo": "https://github.com/xxlong0/Wonder3D",
    "category": "multi-view-diffusion",
    "chain": "none",
    "description": "Single image to 3D using cross-domain diffusion over normal maps and color images.",
    "status": "active",
    "license": "MIT",
    "added": "2026-10-10"
  },
  {
    "id": "zero-1-to-3",
    "name": "Zero-1-to-3",
    "url": "https://zero123.cs.columbia.edu/",
    "repo": "https://github.com/cvlab-columbia/zero123",
    "category": "multi-view-diffusion",
    "chain": "none",